Authors,Title,Year,Source title,Volume,Issue,Art. No.,Page start,Page end,Page count,Cited by,DOI,Link,Document Type,Access Type,Source,EID
"Schlader, Z.J., Wilson, T.E., Crandall, C.G.","Mechanisms of orthostatic intolerance during heat stress",2016,"Autonomic Neuroscience: Basic and Clinical","196",,,"37","46",,4,10.1016/j.autneu.2015.12.005,"https://www.scopus.com/inward/record.uri?eid=2-s2.0-84963815725&doi=10.1016%2fj.autneu.2015.12.005&partnerID=40&md5=05723db486ea75897a91d4c8ba47a6ad",Review,,Scopus,2-s2.0-84963815725
"Batley, J., Edwards, D.","The application of genomics and bioinformatics to accelerate crop improvement in a changing climate",2016,"Current Opinion in Plant Biology","30",,,"78","81",,4,10.1016/j.pbi.2016.02.002,"https://www.scopus.com/inward/record.uri?eid=2-s2.0-84959145150&doi=10.1016%2fj.pbi.2016.02.002&partnerID=40&md5=5969d7a91b69228691dd5e5c6a8e55ee",Review,,Scopus,2-s2.0-84959145150
"Waldo, S., Jensen, F., Nielsen, M., Ellefsen, H., Hallgrimsson, J., Hammarlund, C., Hermansen, ., Isaksen, J.","Regulating Multiple Externalities: The Case of Nordic Fisheries",2016,"Marine Resource Economics","31","2",,"233","257",,4,10.1086/685286,"https://www.scopus.com/inward/record.uri?eid=2-s2.0-84964845688&doi=10.1086%2f685286&partnerID=40&md5=48ff532d7a668e1e5ec405f87378e39f",Review,,Scopus,2-s2.0-84964845688
"Paul, P., Al Tenaiji, A.K., Braimah, N.","A review of the water and energy sectors and the use of a nexus approach in Abu Dhabi",2016,"International Journal of Environmental Research and Public Health","13","4", 364,"","",,4,10.3390/ijerph13040364,"https://www.scopus.com/inward/record.uri?eid=2-s2.0-84961647398&doi=10.3390%2fijerph13040364&partnerID=40&md5=c7486af99f17edf67b4594c439880ea8",Review,,Scopus,2-s2.0-84961647398
"Sanmartín, I., Meseguer, A.S.","Extinction in phylogenetics and biogeography: From timetrees to patterns of biotic assemblage",2016,"Frontiers in Genetics","7","MAR", 35,"","",,4,10.3389/fgene.2016.00035,"https://www.scopus.com/inward/record.uri?eid=2-s2.0-84964848330&doi=10.3389%2ffgene.2016.00035&partnerID=40&md5=6c730349d2c17ade567ebc311a8a588b",Review,,Scopus,2-s2.0-84964848330
"Loehle, C., Idso, C., Bently Wigley, T.","Physiological and ecological factors influencing recent trends in United States forest health responses to climate change",2016,"Forest Ecology and Management","363",,,"179","189",,4,10.1016/j.foreco.2015.12.042,"https://www.scopus.com/inward/record.uri?eid=2-s2.0-84952935412&doi=10.1016%2fj.foreco.2015.12.042&partnerID=40&md5=87a96072618b43a0d734c8360d647b98",Review,,Scopus,2-s2.0-84952935412
"Turner, J.B., Kumar, A., Koch, C.A.","The effects of indoor and outdoor temperature on metabolic rate and adipose tissue – the Mississippi perspective on the obesity epidemic",2016,"Reviews in Endocrine and Metabolic Disorders","17","1",,"61","71",,4,10.1007/s11154-016-9358-z,"https://www.scopus.com/inward/record.uri?eid=2-s2.0-84966650589&doi=10.1007%2fs11154-016-9358-z&partnerID=40&md5=959f5b3a627d8797e5c26f9e89c03fd5",Review,,Scopus,2-s2.0-84966650589
"Taylor, S., Kumar, L.","Global climate change impacts on Pacific Islands terrestrial biodiversity: A review [Mondiaux Impacts des changements climatiques sur la biodiversité des îles du Pacifique terrestres: Examen]",2016,"Tropical Conservation Science","9","1",,"203","223",,4,10.1177/194008291600900111,"https://www.scopus.com/inward/record.uri?eid=2-s2.0-84961960489&doi=10.1177%2f194008291600900111&partnerID=40&md5=eb9c612d975b3afa93aade537fced11f",Review,,Scopus,2-s2.0-84961960489
"Isbell, J.L., Biakov, A.S., Vedernikov, I.L., Davydov, V.I., Gulbranson, E.L., Fedorchuk, N.D.","Permian diamictites in northeastern Asia: Their significance concerning the bipolarity of the late Paleozoic ice age",2016,"Earth-Science Reviews","154",,,"279","300",,4,10.1016/j.earscirev.2016.01.007,"https://www.scopus.com/inward/record.uri?eid=2-s2.0-84957310999&doi=10.1016%2fj.earscirev.2016.01.007&partnerID=40&md5=ddd742477b808434b0fb2d155dc79986",Review,,Scopus,2-s2.0-84957310999
"Barton, C.M., Ullah, I.I.T., Bergin, S.M., Sarjoughian, H.S., Mayer, G.R., Bernabeu-Auban, J.E., Heimsath, A.M., Acevedo, M.F., Riel-Salvatore, J.G., Arrowsmith, J.R.","Experimental socioecology: Integrative science for anthropocene landscape dynamics",2016,"Anthropocene","13",,,"34","45",,4,10.1016/j.ancene.2015.12.004,"https://www.scopus.com/inward/record.uri?eid=2-s2.0-84961778181&doi=10.1016%2fj.ancene.2015.12.004&partnerID=40&md5=a3df3f154b377f54d150bd9c30550824",Review,,Scopus,2-s2.0-84961778181
"Swanepoel, C.M., van der Laan, M., Weepener, H.L., du Preez, C.C., Annandale, J.G.","Review and meta-analysis of organic matter in cultivated soils in southern Africa",2016,"Nutrient Cycling in Agroecosystems","104","2",,"107","123",,4,10.1007/s10705-016-9763-4,"https://www.scopus.com/inward/record.uri?eid=2-s2.0-84955572012&doi=10.1007%2fs10705-016-9763-4&partnerID=40&md5=d6808525588ea37c3f84de5011940424",Review,,Scopus,2-s2.0-84955572012
"Black, C.E.","A comprehensive review of the phenology of Pygoscelis penguins",2016,"Polar Biology","39","3",,"405","432",,4,10.1007/s00300-015-1807-8,"https://www.scopus.com/inward/record.uri?eid=2-s2.0-84959476232&doi=10.1007%2fs00300-015-1807-8&partnerID=40&md5=7809d89f44bf1e6bc43b6c7a5360353c",Review,,Scopus,2-s2.0-84959476232
"Soneja, S.I., Tielsch, J.M., Khatry, S.K., Curriero, F.C., Breysse, P.N.","Highlighting Uncertainty and Recommendations for Improvement of Black Carbon Biomass Fuel-Based Emission Inventories in the Indo-Gangetic Plain Region",2016,"Current environmental health reports","3","1",,"73","80",,4,10.1007/s40572-016-0075-2,"https://www.scopus.com/inward/record.uri?eid=2-s2.0-85015729357&doi=10.1007%2fs40572-016-0075-2&partnerID=40&md5=009aac66d455f1fae18c55f0be5df878",Review,,Scopus,2-s2.0-85015729357
"Hansen, A., Ireland, K., Legg, K., Keane, R., Barge, E., Jenkins, M., Pillet, M.","Complex challenges of maintaining Whitebark pine in Greater Yellowstone under climate change: A call for innovative research, management, and policy approaches",2016,"Forests","7","3", 54,"","",,4,10.3390/f7030054,"https://www.scopus.com/inward/record.uri?eid=2-s2.0-84963956611&doi=10.3390%2ff7030054&partnerID=40&md5=fff1e21d2dcd8ac87ec2c98de347c262",Review,,Scopus,2-s2.0-84963956611
"Grant, C., Lo Iacono, G., Dzingirai, V., Bett, B., Winnebah, T.R.A., Atkinson, P.M.","Moving interdisciplinary science forward: Integrating participatory modelling with mathematical modelling of zoonotic disease in Africa",2016,"Infectious Diseases of Poverty","5","1", 17,"","",,4,10.1186/s40249-016-0110-4,"https://www.scopus.com/inward/record.uri?eid=2-s2.0-85006190453&doi=10.1186%2fs40249-016-0110-4&partnerID=40&md5=9527c7e8b41fb55855b77c9715efa4db",Review,,Scopus,2-s2.0-85006190453
"Coufal-Majewski, S., Stanford, K., McAllister, T., Blakley, B., McKinnon, J., Chaves, A.V., Wang, Y.","Impacts of cereal ergot in food animal production",2016,"Frontiers in Veterinary Science","3","FEB", 15,"","",,4,10.3389/fvets.2016.00015,"https://www.scopus.com/inward/record.uri?eid=2-s2.0-85010265024&doi=10.3389%2ffvets.2016.00015&partnerID=40&md5=fd493971f71dc096ea11e71e21a4472b",Review,,Scopus,2-s2.0-85010265024
"Gutierrez, K.S., LePrevost, C.E.","Climate justice in rural southeastern united states: A review of climate change impacts and effects on human health",2016,"International Journal of Environmental Research and Public Health","13","2", 189,"","",,4,10.3390/ijerph13020189,"https://www.scopus.com/inward/record.uri?eid=2-s2.0-84957539080&doi=10.3390%2fijerph13020189&partnerID=40&md5=fc7d41775a8232f95421df947824c454",Review,,Scopus,2-s2.0-84957539080
"Fan, X.-C., Wang, W.-Q.","Spatial patterns and influencing factors of China's wind turbine manufacturing industry: A review",2016,"Renewable and Sustainable Energy Reviews","54",,,"482","496",,4,10.1016/j.rser.2015.10.020,"https://www.scopus.com/inward/record.uri?eid=2-s2.0-84946434317&doi=10.1016%2fj.rser.2015.10.020&partnerID=40&md5=4dd1ba402d2d46abb079036d8bb7517b",Review,,Scopus,2-s2.0-84946434317
"Sanches-Pereira, A., Tudeschini, L.G., Coelho, S.T.","Evolution of the Brazilian residential carbon footprint based on direct energy consumption",2016,"Renewable and Sustainable Energy Reviews","54",,,"184","201",,4,10.1016/j.rser.2015.09.024,"https://www.scopus.com/inward/record.uri?eid=2-s2.0-84945161701&doi=10.1016%2fj.rser.2015.09.024&partnerID=40&md5=831947a38d5ca95e140c734589dbaa6a",Review,,Scopus,2-s2.0-84945161701
"Pan, Y.W., Fan, W., Zhang, D.H., Chen, J.W., Huang, H.C., Liu, S.X., Jiang, Z.P., Di, Y.N., Tong, M.M., Chen, Y.","Research progress in artificial upwelling and its potential environmental effects",2016,"Science China Earth Sciences","59","2",,"236","248",,4,10.1007/s11430-015-5195-2,"https://www.scopus.com/inward/record.uri?eid=2-s2.0-84955664170&doi=10.1007%2fs11430-015-5195-2&partnerID=40&md5=2c309221928a30fe641b9132c8b79a02",Review,,Scopus,2-s2.0-84955664170
"Chakma, S., Ranjan, A., Choudhury, H.A., Dikshit, P.K., Moholkar, V.S.","Bioenergy from rice crop residues: Role in developing economies",2016,"Clean Technologies and Environmental Policy","18","2",,"373","394",,4,10.1007/s10098-015-1051-5,"https://www.scopus.com/inward/record.uri?eid=2-s2.0-84958539997&doi=10.1007%2fs10098-015-1051-5&partnerID=40&md5=dcc72f21b115d3a1e99cb65c1e980c7f",Review,,Scopus,2-s2.0-84958539997
"Menéndez, C.G., Zaninelli, P.G., Carril, A.F., Sánchez, E.","Hydrological cycle, temperature, and land surface-atmosphere interaction in the la Plata Basin during summer: Response to climate change",2016,"Climate Research","68","2-3",,"231","241",,4,10.3354/cr01373,"https://www.scopus.com/inward/record.uri?eid=2-s2.0-84966552802&doi=10.3354%2fcr01373&partnerID=40&md5=12e8638aa0caecb3d6af89f09a6e6627",Review,,Scopus,2-s2.0-84966552802
"Choi, P.-S., Jeong, J.-M., Choi, Y.-K., Kim, M.-S., Shin, G.-J., Park, S.-J.","A review: Methane capture by nanoporous carbon materials for automobiles",2016,"Carbon Letters","17","1",,"18","28",,4,10.5714/CL.2016.17.1.018,"https://www.scopus.com/inward/record.uri?eid=2-s2.0-85000454218&doi=10.5714%2fCL.2016.17.1.018&partnerID=40&md5=0ae1513653a2715bdacf98b93dbb65ec",Review,,Scopus,2-s2.0-85000454218
"Youinou, G.J.","Powering sustainable low-carbon economies: Some facts and figures",2016,"Renewable and Sustainable Energy Reviews","53",,,"1626","1633",,4,10.1016/j.rser.2015.08.067,"https://www.scopus.com/inward/record.uri?eid=2-s2.0-84944809911&doi=10.1016%2fj.rser.2015.08.067&partnerID=40&md5=7b9b597aa228424fc4dc0e865f31a386",Review,,Scopus,2-s2.0-84944809911
"Hing, S., Narayan, E.J., Thompson, R.C.A., Godfrey, S.S.","The relationship between physiological stress and wildlife disease: Consequences for health and conservation",2016,"Wildlife Research","43","1",,"51","60",,4,10.1071/WR15183,"https://www.scopus.com/inward/record.uri?eid=2-s2.0-84962467055&doi=10.1071%2fWR15183&partnerID=40&md5=0df0e71ee4d8769d3527d1adc423bf96",Review,,Scopus,2-s2.0-84962467055
"Bernardino, A.F., Pagliosa, P.R., Christofoletti, R.A., Barros, F., Netto, S.A., Muniz, P., Lana, P.C.","Benthic estuarine communities in Brazil: Moving forward to long term studies to assess climate change impacts",2016,"Brazilian Journal of Oceanography","64","Special Issue 2",,"81","96",,4,10.1590/S1679-875920160849064sp2,"https://www.scopus.com/inward/record.uri?eid=2-s2.0-84983032226&doi=10.1590%2fS1679-875920160849064sp2&partnerID=40&md5=7c5659d17008d502dafb64fb3c47385c",Review,,Scopus,2-s2.0-84983032226
"Anthony, T.G.","Mechanisms of protein balance in skeletal muscle",2016,"Domestic Animal Endocrinology","56",,,"S23","S32",,4,10.1016/j.domaniend.2016.02.012,"https://www.scopus.com/inward/record.uri?eid=2-s2.0-84979680858&doi=10.1016%2fj.domaniend.2016.02.012&partnerID=40&md5=f6ef00cc59c132a7655516fb4ae2e195",Review,,Scopus,2-s2.0-84979680858
"Nelson, M.N., Lilley, J.M., Helliwell, C., Taylor, C.M., Siddique, K.H.M., Chen, S., Raman, H., Batley, J., Cowling, W.A.","Can genomics assist the phenological adaptation of canola to new and changing environments?",2016,"Crop and Pasture Science","67","3-4",,"284","297",,4,10.1071/CP15320,"https://www.scopus.com/inward/record.uri?eid=2-s2.0-84969508894&doi=10.1071%2fCP15320&partnerID=40&md5=f01fa51b13d3f4276d4b4bee83d4b7e5",Review,,Scopus,2-s2.0-84969508894
"Abraham, V., Kuneš, P., Petr, L., Svitavská Svobodová, H., Kozáková, R., Jamrichová, E., Śvarcová, M.G., Pokorný, P.","A pollen-based quantitative reconstruction of the Holocene vegetation updates a perspective on the natural vegetation in the Czech Republic and Slovakia",2016,"Preslia","88","4",,"409","434",,4,,"https://www.scopus.com/inward/record.uri?eid=2-s2.0-85003028038&partnerID=40&md5=dad832f62c9962cf9de92dbb32966fcc",Review,,Scopus,2-s2.0-85003028038
"Orsini, C., Binnie, V.I., Wilson, S.L.","Determinants and outcomes of motivation in health professions education: a systematic review based on self-determination theory",2016,"Journal of educational evaluation for health professions","13",,,"19","",,4,10.3352/jeehp.2016.13.19,"https://www.scopus.com/inward/record.uri?eid=2-s2.0-84995686574&doi=10.3352%2fjeehp.2016.13.19&partnerID=40&md5=b59491d4d9549f8f5f454897f963fc99",Review,,Scopus,2-s2.0-84995686574
"Hyndes, G.A., Heck, K.L., Vergés, A., Harvey, E.S., Kendrick, G.A., Lavery, P.S., McMahon, K., Orth, R.J., Pearce, A., Vanderklift, M., Wernberg, T., Whiting, S., Wilson, S.","Accelerating tropicalization and the transformation of temperate seagrass meadows",2016,"BioScience","66","11",,"938","945",,4,10.1093/biosci/biw111,"https://www.scopus.com/inward/record.uri?eid=2-s2.0-85014806994&doi=10.1093%2fbiosci%2fbiw111&partnerID=40&md5=34b176c5fe1ce59e07f0b3280ca80282",Review,,Scopus,2-s2.0-85014806994
"Trnka, M., Olesen, J.E., Kersebaum, K.C., Rötter, R.P., Brázdil, R., Eitzinger, J., Jansen, S., Skjelvåg, A.O., Peltonen-Sainio, P., Hlavinka, P., Balek, J., Eckersten, H., Gobin, A., Vučeti, V., Dalla Marta, A., Orlandini, S., Alexandrov, V., Semerádová, D., Štěpánek, P., Svobodová, E., Rajdl, K.","Changing regional weather-crop yield relationships across Europe between 1901 and 2012",2016,"Climate Research","70","2",,"195","214",,4,10.3354/cr01426,"https://www.scopus.com/inward/record.uri?eid=2-s2.0-85018526057&doi=10.3354%2fcr01426&partnerID=40&md5=c2c14eebbe5af03b90e65b9c2b0f8abd",Review,,Scopus,2-s2.0-85018526057
"Hassan, A., Jin, S.","Water storage changes and balances in Africa observed by GRACE and hydrologic models",2016,"Geodesy and Geodynamics","7","1",,"39","49",,4,10.1016/j.geog.2016.03.002,"https://www.scopus.com/inward/record.uri?eid=2-s2.0-84978388460&doi=10.1016%2fj.geog.2016.03.002&partnerID=40&md5=82504e736a736d864e777ad1aedeb88e",Review,Open Access,Scopus,2-s2.0-84978388460
"Schobben, M., Stebbins, A., Ghaderi, A., Strauss, H., Korn, D., Korte, C.","Eutrophication, microbial-sulfate reduction and mass extinctions",2016,"Communicative and Integrative Biology","9","1",,"","",9,4,10.1080/19420889.2015.1115162,"https://www.scopus.com/inward/record.uri?eid=2-s2.0-84960874038&doi=10.1080%2f19420889.2015.1115162&partnerID=40&md5=0fdfdbb1a2ad3f608db0b615d469fc90",Review,,Scopus,2-s2.0-84960874038
"Matzke, N.J.","The evolution of antievolution policies after Kitzmiller v. Dover: A phylogeny identifies ancestors of modern creationist legislation",2016,"Science","351","6268",,"28","30",,4,10.1126/science.aad4057,"https://www.scopus.com/inward/record.uri?eid=2-s2.0-84952878863&doi=10.1126%2fscience.aad4057&partnerID=40&md5=4ca6ce675fc000c9b539dcd3950210a2",Review,,Scopus,2-s2.0-84952878863
"Xu, Z., Jiang, Y., Zhou, G.","Nitrogen cycles in terrestrial ecosystems: Climate change impacts and mitigation",2016,"Environmental Reviews","24","2",,"132","143",,4,10.1139/er-2015-0066,"https://www.scopus.com/inward/record.uri?eid=2-s2.0-84971450226&doi=10.1139%2fer-2015-0066&partnerID=40&md5=5e4a2c70bcd895e5371ba1041e577c9c",Review,,Scopus,2-s2.0-84971450226
"Mace, M.J.","Mitigation Commitments under the Paris Agreement and the Way Forward",2016,"Climate Law","6","1-2",,"21","39",,4,10.1163/18786561-00601002,"https://www.scopus.com/inward/record.uri?eid=2-s2.0-84977659811&doi=10.1163%2f18786561-00601002&partnerID=40&md5=23dd66658484d4d49146b66f0a33cbe0",Review,,Scopus,2-s2.0-84977659811
"Hauser, D.D.W., Tobin, E.D., Feifel, K.M., Shah, V., Pietri, D.M.","Disciplinary reporting affects the interpretation of climate change impacts in global oceans",2016,"Global Change Biology","22","1",,"25","43",,4,10.1111/gcb.12978,"https://www.scopus.com/inward/record.uri?eid=2-s2.0-84954377494&doi=10.1111%2fgcb.12978&partnerID=40&md5=cd231435a78c77cfe8a5736c63e76ff6",Review,Open Access,Scopus,2-s2.0-84954377494
"Holyoak, M., Heath, S.K.","The integration of climate change, spatial dynamics, and habitat fragmentation: A conceptual overview",2016,"Integrative Zoology","11","1",,"40","59",,4,10.1111/1749-4877.12167,"https://www.scopus.com/inward/record.uri?eid=2-s2.0-84955622695&doi=10.1111%2f1749-4877.12167&partnerID=40&md5=1dc97a80d8c2ea562883401ec0425f3d",Review,,Scopus,2-s2.0-84955622695
"Zougmoré, R., Partey, S., Ouédraogo, M., Omitoyin, B., Thomas, T., Ayantunde, A., Ericksen, P., Said, M., Jalloh, A.","Toward climate-smart agriculture in West Africa: A review of climate change impacts, adaptation strategies and policy developments for the livestock, fishery and crop production sectors",2016,"Agriculture and Food Security","5","1", 26,"","",,3,10.1186/s40066-016-0075-3,"https://www.scopus.com/inward/record.uri?eid=2-s2.0-85006364978&doi=10.1186%2fs40066-016-0075-3&partnerID=40&md5=4568fd03d9435fd5744c20e8c10ed197",Review,,Scopus,2-s2.0-85006364978
"Nash, D.J., De Cort, G., Chase, B.M., Verschuren, D., Nicholson, S.E., Shanahan, T.M., Asrat, A., Lézine, A.-M., Grab, S.W.","African hydroclimatic variability during the last 2000 years",2016,"Quaternary Science Reviews","154",,,"1","22",,3,10.1016/j.quascirev.2016.10.012,"https://www.scopus.com/inward/record.uri?eid=2-s2.0-85008601840&doi=10.1016%2fj.quascirev.2016.10.012&partnerID=40&md5=6221629a11318edc52fb9fcbc9f2c08d",Review,,Scopus,2-s2.0-85008601840
"Fuhrer, J., Val Martin, M., Mills, G., Heald, C.L., Harmens, H., Hayes, F., Sharps, K., Bender, J., Ashmore, M.R.","Current and future ozone risks to global terrestrial biodiversity and ecosystem processes",2016,"Ecology and Evolution","6","24",,"8785","8799",,3,10.1002/ece3.2568,"https://www.scopus.com/inward/record.uri?eid=2-s2.0-85006007524&doi=10.1002%2fece3.2568&partnerID=40&md5=7f7f00898474ee2d48037374f07988e3",Review,Open Access,Scopus,2-s2.0-85006007524
"HE, Z., PAGLIARI, P.H., WALDRIP, H.M.","Applied and Environmental Chemistry of Animal Manure: A Review",2016,"Pedosphere","26","6",,"779","816",,3,10.1016/S1002-0160(15)60087-X,"https://www.scopus.com/inward/record.uri?eid=2-s2.0-84995605641&doi=10.1016%2fS1002-0160%2815%2960087-X&partnerID=40&md5=18ca581acab9d42fe32c9fe1fd270a05",Review,,Scopus,2-s2.0-84995605641
"Kramer, L.D.","Complexity of virus–vector interactions",2016,"Current Opinion in Virology","21",,,"81","86",,3,10.1016/j.coviro.2016.08.008,"https://www.scopus.com/inward/record.uri?eid=2-s2.0-84983489994&doi=10.1016%2fj.coviro.2016.08.008&partnerID=40&md5=7b39828be844e4b81df03a94fb66a1e5",Review,,Scopus,2-s2.0-84983489994
"Clavijo McCormick, A.","Can plant–natural enemy communication withstand disruption by biotic and abiotic factors?",2016,"Ecology and Evolution","6","23",,"8569","8582",,3,10.1002/ece3.2567,"https://www.scopus.com/inward/record.uri?eid=2-s2.0-85000443035&doi=10.1002%2fece3.2567&partnerID=40&md5=03a3fd4518d5301e88a1d6fda56dd514",Review,,Scopus,2-s2.0-85000443035
"Thomson, G., Newman, P.","Geoengineering in the anthropocene through regenerative urbanism",2016,"Geosciences (Switzerland)","6","4", 46,"","",,3,10.3390/geosciences6040046,"https://www.scopus.com/inward/record.uri?eid=2-s2.0-84994059916&doi=10.3390%2fgeosciences6040046&partnerID=40&md5=204925a800e78086ce450f215f121594",Review,,Scopus,2-s2.0-84994059916
"Holekamp, K.E., Strauss, E.D.","Aggression and dominance: an interdisciplinary overview",2016,"Current Opinion in Behavioral Sciences","12",,,"44","51",,3,10.1016/j.cobeha.2016.08.005,"https://www.scopus.com/inward/record.uri?eid=2-s2.0-84988531029&doi=10.1016%2fj.cobeha.2016.08.005&partnerID=40&md5=f31a6787c176119749a1918914f7f179",Review,,Scopus,2-s2.0-84988531029
"Laybourn-Parry, J., Pearce, D.","Heterotrophic bacteria in Antarctic lacustrine and glacial environments",2016,"Polar Biology","39","12",,"2207","2225",,3,10.1007/s00300-016-2011-1,"https://www.scopus.com/inward/record.uri?eid=2-s2.0-84979239833&doi=10.1007%2fs00300-016-2011-1&partnerID=40&md5=6ea7dca968c53a6cc4571a782ee24ba6",Review,,Scopus,2-s2.0-84979239833
"Vogiatzakis, I.N., Mannion, A.M., Sarris, D.","Mediterranean island biodiversity and climate change: the last 10,000 years and the future",2016,"Biodiversity and Conservation","25","13",,"2597","2627",,3,10.1007/s10531-016-1204-9,"https://www.scopus.com/inward/record.uri?eid=2-s2.0-84988366003&doi=10.1007%2fs10531-016-1204-9&partnerID=40&md5=663b37dacce0daa0dad308b7c10d064d",Review,,Scopus,2-s2.0-84988366003
"Pushkareva, E., Johansen, J.R., Elster, J.","A review of the ecology, ecophysiology and biodiversity of microalgae in Arctic soil crusts",2016,"Polar Biology","39","12",,"2227","2240",,3,10.1007/s00300-016-1902-5,"https://www.scopus.com/inward/record.uri?eid=2-s2.0-84960105298&doi=10.1007%2fs00300-016-1902-5&partnerID=40&md5=f654391e2809f73327d01578b80ff3b2",Review,,Scopus,2-s2.0-84960105298
"Bretzel, F., Vannucchi, F., Romano, D., Malorgio, F., Benvenuti, S., Pezzarossa, B.","Wildflowers: From conserving biodiversity to urban greening—A review",2016,"Urban Forestry and Urban Greening","20",,,"428","436",,3,10.1016/j.ufug.2016.10.008,"https://www.scopus.com/inward/record.uri?eid=2-s2.0-84994275230&doi=10.1016%2fj.ufug.2016.10.008&partnerID=40&md5=bbd805ef8fa8e3c8f2b0db1edf1da6d0",Review,,Scopus,2-s2.0-84994275230
"Wang, X.L., Feng, Y., Chan, R., Isaac, V.","Inter-comparison of extra-tropical cyclone activity in nine reanalysis datasets",2016,"Atmospheric Research","181",,,"133","153",,3,10.1016/j.atmosres.2016.06.010,"https://www.scopus.com/inward/record.uri?eid=2-s2.0-84976585023&doi=10.1016%2fj.atmosres.2016.06.010&partnerID=40&md5=6bede71eff3b4e838f650a1bbe653fa8",Review,,Scopus,2-s2.0-84976585023
"Pinto, M.I., Burrows, H.D., Sontag, G., Vale, C., Noronha, J.P.","Priority pesticides in sediments of European coastal lagoons: A review",2016,"Marine Pollution Bulletin","112","1-2",,"6","16",,3,10.1016/j.marpolbul.2016.06.101,"https://www.scopus.com/inward/record.uri?eid=2-s2.0-84992562850&doi=10.1016%2fj.marpolbul.2016.06.101&partnerID=40&md5=b77ddf14890905a8f060a744d9572909",Review,,Scopus,2-s2.0-84992562850
"Lamichhane, J.R., Aubertot, J.-N., Begg, G., Birch, A.N.E., Boonekamp, P., Dachbrodt-Saaydeh, S., Hansen, J.G., Hovmøller, M.S., Jensen, J.E., Jørgensen, L.N., Kiss, J., Kudsk, P., Moonen, A.-C., Rasplus, J.-Y., Sattin, M., Streito, J.-C., Messéan, A.","Networking of integrated pest management: A powerful approach to address common challenges in agriculture",2016,"Crop Protection","89",,,"139","151",,3,10.1016/j.cropro.2016.07.011,"https://www.scopus.com/inward/record.uri?eid=2-s2.0-84978915507&doi=10.1016%2fj.cropro.2016.07.011&partnerID=40&md5=0b401a71fae3b4bc05c1dd042c5ed11a",Review,,Scopus,2-s2.0-84978915507
"Wohlfarth, B., Higham, C., Yamoah, K.A., Chabangborn, A., Chawchai, S., Smittenberg, R.H.","Human adaptation to mid- to late-Holocene climate change in Northeast Thailand",2016,"Holocene","26","11",,"1875","1886",,3,10.1177/0959683616645947,"https://www.scopus.com/inward/record.uri?eid=2-s2.0-84990202302&doi=10.1177%2f0959683616645947&partnerID=40&md5=02c0fa6eb367dc46ece278c0d81a0d33",Review,,Scopus,2-s2.0-84990202302
"La Kind, J.S., Overpeck, J., Breysse, P.N., Backer, L., Richardson, S.D., Sobus, J., Sapkota, A., Upperman, C.R., Jiang, C., Beard, C.B., Brunkard, J.M., Bell, J.E., Harris, R., Chretien, J.-P., Peltier, R.E., Chew, G.L., Blount, B.C.","Exposure science in an age of rapidly changing climate: Challenges and opportunities",2016,"Journal of Exposure Science and Environmental Epidemiology","26","6",,"529","538",,3,10.1038/jes.2016.35,"https://www.scopus.com/inward/record.uri?eid=2-s2.0-84980325895&doi=10.1038%2fjes.2016.35&partnerID=40&md5=83843bff9221d6aba6c45e3a833ec846",Review,,Scopus,2-s2.0-84980325895
"McCarl, B.A., Thayer, A.W., Jones, J.P.H.","THE CHALLENGE of CLIMATE CHANGE ADAPTATION for AGRICULTURE: AN ECONOMICALLY ORIENTED REVIEW",2016,"Journal of Agricultural and Applied Economics","48","4",,"321","344",,3,10.1017/aae.2016.27,"https://www.scopus.com/inward/record.uri?eid=2-s2.0-84996572400&doi=10.1017%2faae.2016.27&partnerID=40&md5=d27363d7aacce9d55a8ce209a14d4773",Review,,Scopus,2-s2.0-84996572400
"Özkan, Ş., Vitali, A., Lacetera, N., Amon, B., Bannink, A., Bartley, D.J., Blanco-Penedo, I., de Haas, Y., Dufrasne, I., Elliott, J., Eory, V., Fox, N.J., Garnsworthy, P.C., Gengler, N., Hammami, H., Kyriazakis, I., Leclère, D., Lessire, F., Macleod, M., Robinson, T.P., Ruete, A., Sandars, D.L., Shrestha, S., Stott, A.W., Twardy, S., Vanrobays, M.-L., Ahmadi, B.V., Weindl, I., Wheelhouse, N., Williams, A.G., Williams, H.W., Wilson, A.J., Østergaard, S., Kipling, R.P.","Challenges and priorities for modelling livestock health and pathogens in the context of climate change",2016,"Environmental Research","151",,,"130","144",,3,10.1016/j.envres.2016.07.033,"https://www.scopus.com/inward/record.uri?eid=2-s2.0-84979787953&doi=10.1016%2fj.envres.2016.07.033&partnerID=40&md5=cccf66f3734e2b9e047f9e57531e7165",Review,,Scopus,2-s2.0-84979787953
