Authors,Title,Year,Source title,Volume,Issue,Art. No.,Page start,Page end,Page count,Cited by,DOI,Link,Document Type,Access Type,Source,EID
"Ebi, K.L., Hess, J.J., Isaksen, T.B.","Using Uncertain Climate and Development Information in Health Adaptation Planning",2016,"Current environmental health reports","3","1",,"99","105",,1,10.1007/s40572-016-0077-0,"https://www.scopus.com/inward/record.uri?eid=2-s2.0-85020374410&doi=10.1007%2fs40572-016-0077-0&partnerID=40&md5=5bfdf5a17237d7b560f7870326823133",Review,,Scopus,2-s2.0-85020374410
"Grose, J., Richardson, J., Mills, I., Moles, D., Nasser, M.","Exploring attitudes and knowledge of climate change and sustainability in a dental practice: A feasibility study into resource management",2016,"British Dental Journal","220","4",,"187","191",,1,10.1038/sj.bdj.2016.136,"https://www.scopus.com/inward/record.uri?eid=2-s2.0-84959282467&doi=10.1038%2fsj.bdj.2016.136&partnerID=40&md5=7ba408564963d48ad8aafa5fce817cd3",Review,,Scopus,2-s2.0-84959282467
"Simpson, I.R.","Climate change predicted to lengthen transatlantic travel times",2016,"Environmental Research Letters","11","3", 031002,"","",,1,10.1088/1748-9326/11/3/031002,"https://www.scopus.com/inward/record.uri?eid=2-s2.0-84962308351&doi=10.1088%2f1748-9326%2f11%2f3%2f031002&partnerID=40&md5=c65cfaf95edef33c7552e11b5f480396",Review,,Scopus,2-s2.0-84962308351
"Lal, A.","Spatial Modelling tools to integrate public health and environmental science, illustrated with infectious cryptosporidiosis",2016,"International Journal of Environmental Research and Public Health","13","2", 186,"","",,1,10.3390/ijerph13020186,"https://www.scopus.com/inward/record.uri?eid=2-s2.0-84957603605&doi=10.3390%2fijerph13020186&partnerID=40&md5=eae2649d54df9482dbc7ea9730a3e206",Review,,Scopus,2-s2.0-84957603605
"Fuentes, M.M.P.B., Chambers, L., Chin, A., Dann, P., Dobbs, K., Marsh, H., Poloczanska, E.S., Maison, K., Turner, M., Pressey, R.L.","Adaptive management of marine mega-fauna in a changing climate",2016,"Mitigation and Adaptation Strategies for Global Change","21","2",,"209","224",,1,10.1007/s11027-014-9590-3,"https://www.scopus.com/inward/record.uri?eid=2-s2.0-84957440227&doi=10.1007%2fs11027-014-9590-3&partnerID=40&md5=ee09ddd772733e83aecacb45ca6862e1",Review,,Scopus,2-s2.0-84957440227
"Dhruba Bijaya, G.C., Cheng, S., Xu, Z., Bhandari, J., Wang, L., Liu, X.","Community forestry and livelihood in Nepal: A review",2016,"Journal of Animal and Plant Sciences","26","1",,"1","12",,1,,"https://www.scopus.com/inward/record.uri?eid=2-s2.0-84959086357&partnerID=40&md5=5a3653909b53b7b39cd9caf5d053c6ed",Review,,Scopus,2-s2.0-84959086357
"Slovic, A.D., de Oliveira, M.A., Biehl, J., Ribeiro, H.","How Can Urban Policies Improve Air Quality and Help Mitigate Global Climate Change: a Systematic Mapping Review",2016,"Journal of Urban Health","93","1",,"73","95",,1,10.1007/s11524-015-0007-8,"https://www.scopus.com/inward/record.uri?eid=2-s2.0-84951727779&doi=10.1007%2fs11524-015-0007-8&partnerID=40&md5=24e8115da1ecd342708fcf0c54d01a57",Review,,Scopus,2-s2.0-84951727779
"Zhao, S.J., Lü, B.Q., Li, R.W., Zhu, A.Y., Wu, C.W.","A preliminary analysis of fishery resource exhaustion in the context of biodiversity decline",2016,"Science China Earth Sciences","59","2",,"223","235",,1,10.1007/s11430-015-5193-4,"https://www.scopus.com/inward/record.uri?eid=2-s2.0-84955639939&doi=10.1007%2fs11430-015-5193-4&partnerID=40&md5=f8b7fa5c9fb81d5b4eefc51fecdd2ee0",Review,,Scopus,2-s2.0-84955639939
"Haddaway, N.R., Hedlund, K., Jackson, L.E., Kätterer, T., Lugato, E., Thomsen, I.K., Jørgensen, H.B., Isberg, P.-E.","Which agricultural management interventions are most influential on soil organic carbon (using time series data)?",2016,"Environmental Evidence","5","1", 2,"","",,1,10.1186/s13750-016-0053-z,"https://www.scopus.com/inward/record.uri?eid=2-s2.0-84961295793&doi=10.1186%2fs13750-016-0053-z&partnerID=40&md5=a772fcbf70ba5b0ac08ff277e5a77d93",Review,,Scopus,2-s2.0-84961295793
"Kozlowski, M., Yusof, Y.M.","The role of urban planning and design in responding to climate change: the Brisbane experience",2016,"International Journal of Climate Change Strategies and Management","8","1",,"80","95",,1,10.1108/IJCCSM-05-2014-0064,"https://www.scopus.com/inward/record.uri?eid=2-s2.0-84953432975&doi=10.1108%2fIJCCSM-05-2014-0064&partnerID=40&md5=e7075d1a0c5a9da2a7a69bbdc1f9e95a",Review,,Scopus,2-s2.0-84953432975
"Kugler, N.R., Moraga Sariego, P.","“Climate change damages”, conceptualization of a legal notion with regard to reparation under international law",2016,"Climate Risk Management","13",,,"103","111",,1,10.1016/j.crm.2016.06.004,"https://www.scopus.com/inward/record.uri?eid=2-s2.0-84979669536&doi=10.1016%2fj.crm.2016.06.004&partnerID=40&md5=632db1d1d524ccc3e68d356fcd95cc3f",Review,Open Access,Scopus,2-s2.0-84979669536
"Harrell, S., Qingxia, Y., Viraldo, S.J., Hagmann, R.K., Hinckley, T., Schmidt, A.H.","Forest is forest and meadows are meadows: Cultural landscapes and bureaucratic landscapes in Jiuzhaigou County, Sichuan",2016,"Archiv Orientalni","84","3",,"595","623",,1,,"https://www.scopus.com/inward/record.uri?eid=2-s2.0-85014070466&partnerID=40&md5=5387d2e78626f05607971e88b2fc0d42",Review,,Scopus,2-s2.0-85014070466
"Stulec, I., Petljak, K., Bakovic, T.","Effectiveness of weather derivatives as a hedge against the weather risk in agriculture",2016,"Agricultural Economics (Czech Republic)","62","8",,"356","362",,1,10.17221/188/2015-AGRICECON,"https://www.scopus.com/inward/record.uri?eid=2-s2.0-84985930943&doi=10.17221%2f188%2f2015-AGRICECON&partnerID=40&md5=15f57501cab2c4c315dbfa7b9f5789d9",Review,,Scopus,2-s2.0-84985930943
"Wambui, J.M., Karuri, E.G., Ojiambo, J.A., Njage, P.M.K.","Adaptation and mitigation options to manage aflatoxin contamination in food with a climate change perspective",2016,"World Mycotoxin Journal","9","5",,"875","888",,1,10.3920/WMJ2016.2109,"https://www.scopus.com/inward/record.uri?eid=2-s2.0-85012067929&doi=10.3920%2fWMJ2016.2109&partnerID=40&md5=f769e6a58daecfdf62e56cf25ce374a5",Review,,Scopus,2-s2.0-85012067929
"Vanderhaegen, S., Canters, F.","Use of earth observation for monitoring soil sealing trends in Flanders and Brussels between 1976 and 2013",2016,"BELGEO",,"2",,"","",,1,,"https://www.scopus.com/inward/record.uri?eid=2-s2.0-84990872934&partnerID=40&md5=b5a4d17d0e02865a98052d85eab4530a",Review,,Scopus,2-s2.0-84990872934
"Niwas, R., Khichar, M.L.","Managing impact of climatic vagaries on the productivity of wheat and mustard in India",2016,"Mausam","67","1",,"205","222",,1,,"https://www.scopus.com/inward/record.uri?eid=2-s2.0-85028969229&partnerID=40&md5=fa52a0b8d6401c79cb75eb9d4f32d8a5",Review,,Scopus,2-s2.0-85028969229
"Kulkarni, A., Gadgil, S., Patwardhan, S.","Monsoon variability, the 2015 Marathwada drought and rainfed agriculture",2016,"Current Science","111","7",,"1182","1193",,1,10.18520/cs/v111/i7/1182-1193,"https://www.scopus.com/inward/record.uri?eid=2-s2.0-84994323042&doi=10.18520%2fcs%2fv111%2fi7%2f1182-1193&partnerID=40&md5=7a10b3bb1677de20aef5e1b763cba9d1",Review,,Scopus,2-s2.0-84994323042
"Gjerris, M., Gamborg, C., Röcklinsberg, H.","Ethical aspects of insect production for food and feed",2016,"Journal of Insects as Food and Feed","2","2",,"101","110",,1,10.3920/JIFF2015.0097,"https://www.scopus.com/inward/record.uri?eid=2-s2.0-85030844921&doi=10.3920%2fJIFF2015.0097&partnerID=40&md5=90510867296c7936149b545998eca415",Review,,Scopus,2-s2.0-85030844921
"Roberts, L.","Exploring global history through the lens of history of Chemistry: Materials, identities and governance",2016,"History of Science","54","4",,"335","361",,1,10.1177/0073275316681805,"https://www.scopus.com/inward/record.uri?eid=2-s2.0-85014349874&doi=10.1177%2f0073275316681805&partnerID=40&md5=00031b9b3187114f730108de6cb26cff",Review,,Scopus,2-s2.0-85014349874
"Zybura, H., Pewniak, B.","Under-canopy layers in silvicultural planning [Wykorzystanie dolnych warstw drzewostanu w planowaniu hodowlanym]",2016,"Sylwan","160","10",,"815","821",,1,,"https://www.scopus.com/inward/record.uri?eid=2-s2.0-85014727329&partnerID=40&md5=102e957bf581b7a5f699f24d10100eae",Review,,Scopus,2-s2.0-85014727329
"Murphy, L.C.","Policy instruments to improve energy performance of existing owner occupied dwellings: Understanding and insight",2016,"A+BE Architecture and the Built Environment","17",,,"1","242",,1,,"https://www.scopus.com/inward/record.uri?eid=2-s2.0-84992323945&partnerID=40&md5=420c59b59a2738704423e8a6b692ede8",Review,,Scopus,2-s2.0-84992323945
"Every-Palmer, S., Mcbride, S., Berry, H., Menkes, D.B.","Climate change and psychiatry",2016,"Australian and New Zealand Journal of Psychiatry","50","1",,"16","18",,1,10.1177/0004867415615946,"https://www.scopus.com/inward/record.uri?eid=2-s2.0-84951926865&doi=10.1177%2f0004867415615946&partnerID=40&md5=63ac65111df1656d23fddcbe14080ede",Review,,Scopus,2-s2.0-84951926865
"O’Sullivan, O.S., Hopkinson, L., Crockatt, M.E., Laird, P., Bebber, D.P.","Stable forest carbon stocks support current assumption of biogenic carbon neutrality in the case of European-manufactured beverage cartons",2016,"International Journal of Life Cycle Assessment","21","1",,"118","128",,1,10.1007/s11367-015-0989-1,"https://www.scopus.com/inward/record.uri?eid=2-s2.0-84952630162&doi=10.1007%2fs11367-015-0989-1&partnerID=40&md5=c56ed8ee9c00c0acf3319f997f269891",Review,,Scopus,2-s2.0-84952630162
"Visconti, F.","Importance of transient-state models in assessing and predicting water, soil and crop dynamics under irrigated agriculture",2016,"CAB Reviews: Perspectives in Agriculture, Veterinary Science, Nutrition and Natural Resources","11",, A8,"","",,1,10.1079/PAVSNNR20161101,"https://www.scopus.com/inward/record.uri?eid=2-s2.0-85013907513&doi=10.1079%2fPAVSNNR20161101&partnerID=40&md5=8e0c47295abb3ce7941760692018c7bb",Review,,Scopus,2-s2.0-85013907513
"Belesky, D.P., Malinowski, D.P.","Grassland communities in the USA and expected trends associated with climate change",2016,"Acta Agrobotanica","69","2", 1673,"","",,1,10.5586/aa.1673,"https://www.scopus.com/inward/record.uri?eid=2-s2.0-84981166152&doi=10.5586%2faa.1673&partnerID=40&md5=d8afc1086c0a26516e109fa4445b3972",Review,,Scopus,2-s2.0-84981166152
"Hassan, M.Z., Fahim, S.M., Zafr, A.H.A., Islam, M.S., Alam, S.","Healthcare financing in Bangladesh: Challenges and recommendations",2016,"Bangladesh Journal of Medical Science","15","4",,"505","510",,1,10.3329/bjms.v15i4.21698,"https://www.scopus.com/inward/record.uri?eid=2-s2.0-85007226850&doi=10.3329%2fbjms.v15i4.21698&partnerID=40&md5=afa48de59bd7e53ad482c4e4d0893d56",Review,,Scopus,2-s2.0-85007226850
"Phillips, T.","UNASUR-GRID: Financing Sustainable Energy Sovereignty with the Bank of the South",2016,"Advances in Sustainability and Environmental Justice","18",,,"77","109",,1,10.1108/S2051-503020160000018004,"https://www.scopus.com/inward/record.uri?eid=2-s2.0-84959553323&doi=10.1108%2fS2051-503020160000018004&partnerID=40&md5=db351b23342f72dc697a3f10d8192cbf",Review,,Scopus,2-s2.0-84959553323
"Hague, B., Braganza, K., Jones, D.","Effects of heat extremes on wheat yields in Australia",2016,"Journal of Southern Hemisphere Earth Systems Science","66","3",,"314","341",,1,,"https://www.scopus.com/inward/record.uri?eid=2-s2.0-85015380246&partnerID=40&md5=6ae12d8000c2b08840fb03f57556dfde",Review,,Scopus,2-s2.0-85015380246
"Enkelmann, E., Garver, J.I.","Low-temperature thermochronology applied to ancient settings",2016,"Journal of Geodynamics","93",,,"17","30",,1,10.1016/j.jog.2015.11.001,"https://www.scopus.com/inward/record.uri?eid=2-s2.0-84947976495&doi=10.1016%2fj.jog.2015.11.001&partnerID=40&md5=a7d2d5506d856cd73d02b652b99d146e",Review,,Scopus,2-s2.0-84947976495
"Gagné, K., Rasmussen, M.B.","Introduction -An amphibious anthropology: The production of place at the confluence of land and water",2016,"Anthropologica","58","2",,"135","149",,1,10.3138/anth.582.T00.EN,"https://www.scopus.com/inward/record.uri?eid=2-s2.0-85012878785&doi=10.3138%2fanth.582.T00.EN&partnerID=40&md5=82c336240a4d939cb51c44439f0137b9",Review,,Scopus,2-s2.0-85012878785
"Davis, J.","Climate change and the scope for global greenhouse gas reductions",2016,"CAB Reviews: Perspectives in Agriculture, Veterinary Science, Nutrition and Natural Resources","11",, 036,"","",,1,10.1079/PAVSNNR201611036,"https://www.scopus.com/inward/record.uri?eid=2-s2.0-85014054139&doi=10.1079%2fPAVSNNR201611036&partnerID=40&md5=50c761d9b75f49754e3c620f73b33ef2",Review,,Scopus,2-s2.0-85014054139
"Eklund, L., Romankiewicz, C., Brandt, M., Doevenspeck, M., Samimi, C.","Data and methods in the environment-migration nexus: A scale perspective",2016,"Erde","147","2",,"139","152",,1,10.12854/erde-147-10,"https://www.scopus.com/inward/record.uri?eid=2-s2.0-84977109196&doi=10.12854%2ferde-147-10&partnerID=40&md5=a55425644531a6dd7b1388f3b39b6746",Review,,Scopus,2-s2.0-84977109196
"Maria, T.F., Vanaverbeke, J., Vanreusel, A., Esteves, A.M.","Sandy beaches: State of the art of nematode ecology",2016,"Anais da Academia Brasileira de Ciencias","88","3",,"1635","1653",,1,10.1590/0001-3765201620150282,"https://www.scopus.com/inward/record.uri?eid=2-s2.0-84997285739&doi=10.1590%2f0001-3765201620150282&partnerID=40&md5=52793e26d4dd92f77f5cab98f31313df",Review,,Scopus,2-s2.0-84997285739
"Lukito, W., Wibowo, L., Wahlqvist, M.L.","Developments in clinical food and nutrition science in Indonesia",2016,"Asia Pacific Journal of Clinical Nutrition","25",,,"S1","S7",,1,10.6133/apjcn.122016.s14,"https://www.scopus.com/inward/record.uri?eid=2-s2.0-85010677916&doi=10.6133%2fapjcn.122016.s14&partnerID=40&md5=e4a5708c9991e2f388a2cae643faab68",Review,,Scopus,2-s2.0-85010677916
"Mearns, A.J., Reish, D.J., Oshida, P.S., Morrison, A.M., Rempel-Hester, M.A., Arthur, C., Rutherford, N., Pryor, R.","Effects of pollution on marine organisms",2016,"Water Environment Research","88","10",,"1693","1807",,1,10.2175/106143016X14696400495695,"https://www.scopus.com/inward/record.uri?eid=2-s2.0-84992116249&doi=10.2175%2f106143016X14696400495695&partnerID=40&md5=2860f874ef60dfbe7e72b701ef70be45",Review,,Scopus,2-s2.0-84992116249
"Pleyer, U., Klauß, V., Wilking, H., Nentwich, M.M.","Tropical ophthalmology: Intraocular inflammation caused by “new” infectious pathogens and travel-related infections [Tropenophthalmologie: Intraokulare Entzündungen bei „neuen“ Infektionserregern und Reiseinfektionen]",2016,"Ophthalmologe","113","1",,"35","46",,1,10.1007/s00347-015-0176-6,"https://www.scopus.com/inward/record.uri?eid=2-s2.0-84955357934&doi=10.1007%2fs00347-015-0176-6&partnerID=40&md5=7f7e5bec3fa3ec9c7761044fea334ff6",Review,,Scopus,2-s2.0-84955357934
"Brady, H.L.","Justice is no longer blind: How the effort to eradicate sexual assault in the military unbalanced the military justice system",2016,"University of Illinois Law Review","2016","1",,"193","250",,1,,"https://www.scopus.com/inward/record.uri?eid=2-s2.0-84958970792&partnerID=40&md5=f706129b9d4e4cb69ef4f7cf3af4895b",Review,,Scopus,2-s2.0-84958970792
"Inbaraj, S., Sejian, V., Bagath, M., Bhatta, R.","Impact of heat stress on immune responses of livestock: A review",2016,"Pertanika Journal of Tropical Agricultural Science","39","4",,"459","482",,1,,"https://www.scopus.com/inward/record.uri?eid=2-s2.0-85002168966&partnerID=40&md5=5ff195b1a07fb2f8b331383b873d1959",Review,,Scopus,2-s2.0-85002168966
"Anisimov, O.A., Kokorev, V.A.","Climate in the arctic zone of Russia: Analysis of current changes and modeling trends for the 21st century",2016,"Vestnik Moskovskogo Universiteta, Seriya 5: Geografiya","2016-January","1",,"61","70",,1,,"https://www.scopus.com/inward/record.uri?eid=2-s2.0-85020415268&partnerID=40&md5=927fc99d81f8896bda0c9465de8091a1",Review,,Scopus,2-s2.0-85020415268
"Loth, M.M.A.","Climate change liability after all: A Dutch landmark case",2016,"Tilburg Law Review","21","1",,"5","30",,1,10.1163/22112596-02101001,"https://www.scopus.com/inward/record.uri?eid=2-s2.0-84971373894&doi=10.1163%2f22112596-02101001&partnerID=40&md5=00e507c470630c2726f50244d4ec86b0",Review,,Scopus,2-s2.0-84971373894
"Hamer, G.L.","Heterogeneity of mosquito (diptera: Culicidae) control community size, research productivity, and arboviral diseases across the United States",2016,"Journal of Medical Entomology","53","3",,"485","495",,1,10.1093/jme/tjw020,"https://www.scopus.com/inward/record.uri?eid=2-s2.0-85007350716&doi=10.1093%2fjme%2ftjw020&partnerID=40&md5=d300491d5b3fcc65a460682cab55bc34",Review,,Scopus,2-s2.0-85007350716
"Wahlqvist, M.L.","Future food",2016,"Asia Pacific Journal of Clinical Nutrition","25","4",,"706","715",,1,10.6133/apjcn.092016.01,"https://www.scopus.com/inward/record.uri?eid=2-s2.0-84999266436&doi=10.6133%2fapjcn.092016.01&partnerID=40&md5=34ae6a2e087f552e8635fc462d603dd7",Review,,Scopus,2-s2.0-84999266436
"De Albuquerque Cavalcanti, I.F., Silveira, V.P.","Changes in precipitation over the la Plata Basin, projected by CLARIS-LPB regional models",2016,"Climate Research","68","2-3",,"169","182",,1,10.3354/cr01388,"https://www.scopus.com/inward/record.uri?eid=2-s2.0-84966601930&doi=10.3354%2fcr01388&partnerID=40&md5=cdde9e96e6b6b494fc8c16f5ff37785f",Review,,Scopus,2-s2.0-84966601930
"Malavasi, U.C., Davis, A.S., de Matos Malavasi, M.","Estimating water in living woody stems – a review [Estimativa de água em caule lenhosos vivos – uma revisão]",2016,"Cerne","22","4",,"415","422",,1,10.1590/01047760201622032169,"https://www.scopus.com/inward/record.uri?eid=2-s2.0-85015634746&doi=10.1590%2f01047760201622032169&partnerID=40&md5=15903bfa6cd7285c86b57aab7b8837f3",Review,,Scopus,2-s2.0-85015634746
"Zou, H., Gao, G.Y., Fu, B.J.","The relationship between grassland ecosystem and soil water in arid and semiarid areas: A review",2016,"Shengtai Xuebao/ Acta Ecologica Sinica","36","11",,"3127","3136",,1,10.5846/stxb201506211251,"https://www.scopus.com/inward/record.uri?eid=2-s2.0-84973909604&doi=10.5846%2fstxb201506211251&partnerID=40&md5=8a9d7a72ccdc5e505099e129bf0579ef",Review,,Scopus,2-s2.0-84973909604
"Sindico, F.","Paris, Climate Change, and Sustainable Development",2016,"Climate Law","6","1-2",,"130","141",,1,10.1163/18786561-00601009,"https://www.scopus.com/inward/record.uri?eid=2-s2.0-84977630959&doi=10.1163%2f18786561-00601009&partnerID=40&md5=a4db80c05a387e41f78660e519966aa6",Review,,Scopus,2-s2.0-84977630959
"Berchez, F.A.S., Ghilardi-Lopes, N.P., Correia, M.D., Sovierzoski, H.H., Pedrini, A.G., Ursi, S., Kremer, L.P., de Almeida, R., Schaeffer-Novelli, Y., Marques, V., Brotto, D.S.","Marine and coastal environmental education in the context of global climate changes - Synthesis and subsidies for ReBentos (Coastal benthic habitats monitoring network)",2016,"Brazilian Journal of Oceanography","64","Special Issue 2",,"137","156",,1,10.1590/S1679-875920160932064sp2,"https://www.scopus.com/inward/record.uri?eid=2-s2.0-84983036047&doi=10.1590%2fS1679-875920160932064sp2&partnerID=40&md5=a4186cc70020b26f92b754033dfe8481",Review,,Scopus,2-s2.0-84983036047
"Sizov, O.S., Lobotrosova, S.A.","Features of revegetation of drift sand sites in the Northern Taiga subzone of Western Siberia",2016,"Earth's Cryosphere","20","3",,"3","13",,1,10.21782/KZ1560-7496-2016-3(3-13),"https://www.scopus.com/inward/record.uri?eid=2-s2.0-85032278716&doi=10.21782%2fKZ1560-7496-2016-3%283-13%29&partnerID=40&md5=880066222db987783b088e877090b10b",Review,,Scopus,2-s2.0-85032278716
"Chen, S., Shahi, C., Chen, H.Y.H.","Economic and ecological trade-off analysis of forest ecosystems: Options for boreal forests",2016,"Environmental Reviews","24","3",,"348","361",,1,10.1139/er-2015-0090,"https://www.scopus.com/inward/record.uri?eid=2-s2.0-84987615819&doi=10.1139%2fer-2015-0090&partnerID=40&md5=ad9cf382ac968d1488e214ff13c9b185",Review,,Scopus,2-s2.0-84987615819
"Holderegger, R.","Diverse applications of genetic methods in forest ecosystems [Vielfältige Anwendungen genetischer Methoden im Wald]",2016,"Schweizerische Zeitschrift fur Forstwesen","167","6",,"308","315",,1,10.3188/szf.2016.0308,"https://www.scopus.com/inward/record.uri?eid=2-s2.0-85018672485&doi=10.3188%2fszf.2016.0308&partnerID=40&md5=e083985286b6bd31447aa444824907f7",Review,,Scopus,2-s2.0-85018672485
"Canedo, C., Zolá, R.P., Berndtsson, R.","Role of hydrological studies for the development of the TDPS system",2016,"Water (Switzerland)","8","4", 144,"","",,1,10.3390/w8040144,"https://www.scopus.com/inward/record.uri?eid=2-s2.0-84965149304&doi=10.3390%2fw8040144&partnerID=40&md5=86a7662d0931689792d3ce61a63dd469",Review,,Scopus,2-s2.0-84965149304
"Liu, Q., Wan, S., Gu, B.","A Review of the Detection Methods for Climate Regime Shifts",2016,"Discrete Dynamics in Nature and Society","2016",, 3536183,"","",,1,10.1155/2016/3536183,"https://www.scopus.com/inward/record.uri?eid=2-s2.0-84958068766&doi=10.1155%2f2016%2f3536183&partnerID=40&md5=7b90b037da6b5ead1fdb26cb46f4fa31",Review,,Scopus,2-s2.0-84958068766
"Gupta, J.","The Paris Climate Change Agreement: China and India",2016,"Climate Law","6","1-2",,"171","181",,1,10.1163/18786561-00601012,"https://www.scopus.com/inward/record.uri?eid=2-s2.0-84977641957&doi=10.1163%2f18786561-00601012&partnerID=40&md5=eebd48726b0ba0cf25df83246a717c13",Review,,Scopus,2-s2.0-84977641957
"Hanna, S.H.S., Cesaretti, G.P., Misso, R., Osborne-Lee, I.","Ecological currency: A new approach in sustainable development: In the 21st century in relationship to climate change and human imprint impacts",2016,"Rivista di Studi sulla Sostenibilita",,"1",,"13","24",,1,,"https://www.scopus.com/inward/record.uri?eid=2-s2.0-84994473967&partnerID=40&md5=96aabdbefb458b8d5cde509ffb2391b4",Review,,Scopus,2-s2.0-84994473967
"Williford, D., DeYoung, R.W., Honeycutt, R.L., Brennan, L.A., Hernández, F.","Phylogeography of the bobwhite (Colinus) quails",2016,"Wildlife Monographs","193","1",,"1","49",,1,10.1002/wmon.1017,"https://www.scopus.com/inward/record.uri?eid=2-s2.0-84954488460&doi=10.1002%2fwmon.1017&partnerID=40&md5=5bafd666fd280552aeec792096bb5688",Review,,Scopus,2-s2.0-84954488460
"Krč, J., Taylor, A., Hodges, D.","Paying for what you get: Accounting for the nonrenewable component in wood to energy",2016,"Forest Products Journal","66","7-8",,"384","390",,1,10.13073/FPJ-D-15-00081,"https://www.scopus.com/inward/record.uri?eid=2-s2.0-85011003139&doi=10.13073%2fFPJ-D-15-00081&partnerID=40&md5=41655b38410aca0a68f10ccdce575846",Review,,Scopus,2-s2.0-85011003139
"Irl, S.D.H.","Plant diversity on high elevation islands - Drivers of species richness and endemism",2016,"Frontiers of Biogeography","8","3", e29717,"","",,1,,"https://www.scopus.com/inward/record.uri?eid=2-s2.0-85006129594&partnerID=40&md5=ed54c6f2a96f73d453d7e568558d714a",Review,,Scopus,2-s2.0-85006129594
"Streck, C.","Mobilizing Finance for redd + after Paris",2016,"Journal for European Environmental and Planning Law","13","2",,"146","166",,1,10.1163/18760104-01302003,"https://www.scopus.com/inward/record.uri?eid=2-s2.0-84978217200&doi=10.1163%2f18760104-01302003&partnerID=40&md5=e9ed5917c021307dc2be7a0fe03f014d",Review,,Scopus,2-s2.0-84978217200
"Hasnulin, V.I., Voevoda, M.I., Hasnulin, P.V., Artamonova, O.G.","Modern approach to arterial hypertension in the circumpolar and arctic regions. Literature review",2016,"Human Ecology (Russian Federation)",,"3",,"43","51",,1,,"https://www.scopus.com/inward/record.uri?eid=2-s2.0-84991517795&partnerID=40&md5=ba78e0d468090d56d6f7bf147e881006",Review,,Scopus,2-s2.0-84991517795
"Doʇan, E., Kocamaz, U.E., Utkucu, M., Yildirim, E.","Modelling daily water level fluctuations of lake van (eastern Turkey) using artificial neural networks",2016,"Fundamental and Applied Limnology","187","3",,"177","189",,1,10.1127/fal/2015/0736,"https://www.scopus.com/inward/record.uri?eid=2-s2.0-84959040577&doi=10.1127%2ffal%2f2015%2f0736&partnerID=40&md5=25d1792630d7aee028f8597c3a848d31",Review,,Scopus,2-s2.0-84959040577
"Frelich, L.","Forest dynamics",2016,"F1000Research","5",, 183,"","",,1,10.12688/f1000research.7412.1,"https://www.scopus.com/inward/record.uri?eid=2-s2.0-84964515128&doi=10.12688%2ff1000research.7412.1&partnerID=40&md5=c8a3347ec3036c55fa91ffe44a646a27",Review,,Scopus,2-s2.0-84964515128
"Bastos, L., Bio, A., Iglesias, I.","The importance of marine observatories and of RAIA in particular",2016,"Frontiers in Marine Science","3","AUG", 140,"","",,1,10.3389/fmars.2016.00140,"https://www.scopus.com/inward/record.uri?eid=2-s2.0-85008711884&doi=10.3389%2ffmars.2016.00140&partnerID=40&md5=22e5850c10bb634901af640ebfa6f282",Review,,Scopus,2-s2.0-85008711884
"Battilani, P., Stroka, J., Magan, N.","Foreword: Mycotoxins in a changing world",2016,"World Mycotoxin Journal","9","5",,"647","651",,1,10.3920/WMJ2016.x004,"https://www.scopus.com/inward/record.uri?eid=2-s2.0-85012096189&doi=10.3920%2fWMJ2016.x004&partnerID=40&md5=174e35efb81f57456a66c47f8f19bda8",Review,,Scopus,2-s2.0-85012096189
"Horta, P.A., Riul, P., Amado Filho, G.M., Gurgel, C.F.D., Berchez, F., Nunes, J.M.C., Scherner, F., Pereira, S., Lotufo, T., Peres, L., Sissini, M., Bastos, E.O., Rosa, J., Munoz, P., Martins, C., Gouvêa, L., Carvalho, V., Bergstrom, E., Schubert, N., Bahia, R.G., Rodrigues, A.C., Rörig, L., Barufi, J.B., Figueiredo, M.","Rhodoliths in Brazil: Current knowledge and potential impacts of climate change",2016,"Brazilian Journal of Oceanography","64","Special Issue 2",,"117","136",,1,10.1590/S1679-875920160870064sp2,"https://www.scopus.com/inward/record.uri?eid=2-s2.0-84983035911&doi=10.1590%2fS1679-875920160870064sp2&partnerID=40&md5=008284e6ece51c44b062c7268ca55db9",Review,,Scopus,2-s2.0-84983035911
